{"catalogVersion":"safe-execution-v1","profiles":[{"defaultSuggestion":"never","expectedKind":"directory","fixtureIDs":["cache-go-build-active","cache-go-build-config","cache-go-build-other","cache-go-build-positive"],"id":"phase-c.go-build-cache-v1","processSubjects":{"bundleIdentifiers":[],"exactNames":["asm","cgo","compile","go","link"],"versionedFamilies":[]},"relativePath":"Library/Caches/go-build","resolverBindings":[{"key":"activity.process.inactive","resolver":"currentActivity"},{"key":"evidence.cache.layout","resolver":"compilerAttested"},{"key":"evidence.cache.reclaimable","resolver":"compilerAttested"},{"key":"evidence.cache.tool-owned","resolver":"compilerAttested"},{"key":"evidence.scope.user-owned","resolver":"currentFilesystem"}],"ruleID":"cache-go-build"},{"defaultSuggestion":"readyWhenEligible","expectedKind":"directory","fixtureIDs":["cache-npm-content-active","cache-npm-content-config","cache-npm-content-other","cache-npm-content-positive"],"id":"phase-c.npm-cacache-v1","processSubjects":{"bundleIdentifiers":[],"exactNames":["corepack","node","npm","npx"],"versionedFamilies":[]},"relativePath":".npm/_cacache","resolverBindings":[{"key":"activity.process.inactive","resolver":"currentActivity"},{"key":"evidence.cache.layout","resolver":"compilerAttested"},{"key":"evidence.cache.reclaimable","resolver":"compilerAttested"},{"key":"evidence.cache.tool-owned","resolver":"compilerAttested"},{"key":"evidence.scope.user-owned","resolver":"currentFilesystem"}],"ruleID":"cache-npm-content"},{"defaultSuggestion":"readyWhenEligible","expectedKind":"directory","fixtureIDs":["cache-pip-active","cache-pip-config","cache-pip-other","cache-pip-positive"],"id":"phase-c.pip-cache-v1","processSubjects":{"bundleIdentifiers":[],"exactNames":["pip","python"],"versionedFamilies":["pip","python"]},"relativePath":"Library/Caches/pip","resolverBindings":[{"key":"activity.process.inactive","resolver":"currentActivity"},{"key":"evidence.cache.layout","resolver":"compilerAttested"},{"key":"evidence.cache.reclaimable","resolver":"compilerAttested"},{"key":"evidence.cache.tool-owned","resolver":"compilerAttested"},{"key":"evidence.scope.user-owned","resolver":"currentFilesystem"}],"ruleID":"cache-pip"}],"ruleCatalogVersion":"builtin-runtime-tool-residue-v2","schemaVersion":1}